{
  "schema_version": 1,
  "strategy_id": "graph.targeted-lexical-read",
  "strategy_version": "v1",
  "graph_discovery": "graph_then_targeted_lexical_read",
  "projection": "balanced",
  "reread_policy": "allow",
  "context_window": {
    "compaction": {
      "history_recent_items": 4,
      "summary_max_chars": 2200,
      "emergency_summary_max_chars": 900,
      "deduplicate_tool_results": false
    },
    "section_budgets": [
      { "section_id": "base_runtime_instructions", "max_tokens": 160, "trim_direction": "tail" },
      { "section_id": "response_contract", "max_tokens": 140, "trim_direction": "tail" },
      { "section_id": "objective_state", "max_tokens": 180, "trim_direction": "tail" },
      { "section_id": "selected_history", "max_tokens": 220, "trim_direction": "head" },
      { "section_id": "active_code_windows", "max_tokens": 440, "trim_direction": "tail" },
      { "section_id": "code_navigation_items", "max_tokens": 260, "trim_direction": "tail" },
      { "section_id": "graph_relations", "max_tokens": 180, "trim_direction": "tail" },
      { "section_id": "graph_frontier", "max_tokens": 200, "trim_direction": "tail" },
      { "section_id": "tool_contracts", "max_tokens": 180, "trim_direction": "tail" }
    ]
  }
}
